Delete Account,Esborrar compte
Delete My Account,Suprimeix el meu compte
Submit,Presentar
Please Check Your Registered Email Id to Confirm and delete Your account permanently,Comproveu el vostre identificador de correu electrònic registrat per confirmar i suprimir el vostre compte permanentment
"We can't process your request right now. Sorry, that's all we know","En aquest moment no podem processar la vostra sol·licitud. Ho sentim, això és tot el que sabem"
Your Account Has Been Deleted. Create an Account to Login Again,El vostre compte s'ha suprimit. Creeu un compte per tornar a iniciar la sessió
We can't process your request right now. Sorry,En aquest moment no podem processar la vostra sol·licitud. Ho sento
