Delete Account,Kustuta konto
Delete My Account,Kustuta minu konto
Submit,Esita
Please Check Your Registered Email Id to Confirm and delete Your account permanently,Oma konto jäädavaks kinnitamiseks ja kustutamiseks kontrollige oma registreeritud e-posti aadressi
"We can't process your request right now. Sorry, that's all we know","Me ei saa praegu teie taotlust töödelda. Vabandust, see on kõik, mida me teame"
Your Account Has Been Deleted. Create an Account to Login Again,Teie konto on kustutatud. Looge konto uuesti sisselogimiseks
We can't process your request right now. Sorry,Me ei saa praegu teie taotlust töödelda. Vabandust
