Delete Account,Ezabatu kontua
Delete My Account,Ezabatu Nire kontua
Submit,Bidali
Please Check Your Registered Email Id to Confirm and delete Your account permanently,"Mesedez, egiaztatu erregistratutako posta elektronikoaren IDa zure kontua behin betiko baieztatzeko eta ezabatzeko"
"We can't process your request right now. Sorry, that's all we know","Une honetan ezin dugu zure eskaera prozesatu. Barkatu, hori da dakigun guztia"
Your Account Has Been Deleted. Create an Account to Login Again,Zure kontua ezabatu da. Sortu kontua berriro saioa hasteko
We can't process your request right now. Sorry,Une honetan ezin dugu zure eskaera prozesatu. Barkatu
