Delete Account,حذف حساب کاربری
Delete My Account,حساب من را حذف کنید
Submit,ارسال
Please Check Your Registered Email Id to Confirm and delete Your account permanently,لطفاً برای تأیید و حذف دائمی حساب خود ، شناسه ایمیل ثبت شده خود را بررسی کنید
"We can't process your request right now. Sorry, that's all we know",در حال حاضر نمی توانیم درخواست شما را پردازش کنیم. با عرض پوزش ، این تنها چیزی است که ما می دانیم
Your Account Has Been Deleted. Create an Account to Login Again,حساب شما حذف شده است. برای ورود مجدد حساب کاربری ایجاد کنید
We can't process your request right now. Sorry,در حال حاضر نمی توانیم درخواست شما را پردازش کنیم. متاسف
