Delete Account,Supprimer le compte
Delete My Account,Supprimer mon compte
Submit,Soumettre
Please Check Your Registered Email Id to Confirm and delete Your account permanently,Veuillez vérifier votre adresse e-mail enregistrée pour confirmer et supprimer définitivement votre compte
"We can't process your request right now. Sorry, that's all we know","Nous ne pouvons pas traiter votre demande pour le moment. Désolé, c'est tout ce que nous savons"
Your Account Has Been Deleted. Create an Account to Login Again,Votre compte a été supprimé. Créez un compte pour vous reconnecter
We can't process your request right now. Sorry,Nous ne pouvons pas traiter votre demande pour le moment. Pardon
