Delete Account,מחק חשבון
Delete My Account,מחק את חשבוני
Submit,שלח
Please Check Your Registered Email Id to Confirm and delete Your account permanently,"אנא בדוק את מזהה הדוא""ל הרשום שלך כדי לאשר ולמחוק את חשבונך לצמיתות"
"We can't process your request right now. Sorry, that's all we know","איננו יכולים לעבד את בקשתך כרגע. סליחה, זה כל מה שאנחנו יודעים"
Your Account Has Been Deleted. Create an Account to Login Again,החשבון שלך נמחק. צור חשבון כדי להתחבר שוב
We can't process your request right now. Sorry,איננו יכולים לעבד את בקשתך כרגע. מצטער
