Delete Account,Fiók törlése
Delete My Account,A fiókom törlése
Submit,Beküldés
Please Check Your Registered Email Id to Confirm and delete Your account permanently,"Kérjük, ellenőrizze regisztrált e-mail azonosítóját a fiókja végleges megerősítéséhez és törléséhez"
"We can't process your request right now. Sorry, that's all we know","Jelenleg nem tudjuk feldolgozni a kérését. Bocs, ennyit tudunk"
Your Account Has Been Deleted. Create an Account to Login Again,Fiókját törölték. Hozzon létre egy fiókot az újbóli bejelentkezéshez
We can't process your request right now. Sorry,Jelenleg nem tudjuk feldolgozni a kérését. Sajnálom
