Delete Account,Eyða reikningi
Delete My Account,Eyða reikningnum mínum
Submit,Sendu inn
Please Check Your Registered Email Id to Confirm and delete Your account permanently,Vinsamlegast athugaðu skráða netfangið þitt til að staðfesta og eyða reikningnum þínum varanlega
"We can't process your request right now. Sorry, that's all we know","Við getum ekki afgreitt beiðni þína núna. Því miður, það er allt sem við vitum"
Your Account Has Been Deleted. Create an Account to Login Again,Reikningnum þínum hefur verið eytt. Búðu til reikning til að skrá þig inn aftur
We can't process your request right now. Sorry,Við getum ekki afgreitt beiðni þína núna. Því miður
