Delete Account,Padamkan Akaun
Delete My Account,Padamkan akaun saya
Submit,Hantar
Please Check Your Registered Email Id to Confirm and delete Your account permanently,Sila Periksa Id E-mel Berdaftar Anda untuk Mengesahkan dan menghapus akaun anda secara kekal
"We can't process your request right now. Sorry, that's all we know","Kami tidak dapat memproses permintaan anda sekarang. Maaf, itu sahaja yang kami tahu"
Your Account Has Been Deleted. Create an Account to Login Again,Akaun Anda Telah Dipadamkan. Buat Akaun untuk Masuk Lagi
We can't process your request right now. Sorry,Kami tidak dapat memproses permintaan anda sekarang. Maaf
